{
	"schema_version": "answer_eval_fingerprint.v1",
	"answer_fingerprint_sha256": "sha256:aaaaaaaaaaaaaaaaaaaaaaaaaaaaaaaaaaaaaaaaaaaaaaaaaaaaaaaaaaaaaaaa",
	"run_id": "run_eval_01",
	"request_id": "req_eval_01",
	"trace_id": "trace_eval_01",
	"runtime_release": "execution-control@test",
	"llm_call_site": "agent.primary",
	"llm_io_fingerprint_sha256": "sha256:bbbbbbbbbbbbbbbbbbbbbbbbbbbbbbbbbbbbbbbbbbbbbbbbbbbbbbbbbbbbbbbb",
	"provider_profile_revision": "primary:default:7",
	"output_schema_id": "primary_agent_terminal_output.v1",
	"branch_identity": {
		"schema_version": "answer_branch_identity.v1",
		"prompt_id": "primary_agent",
		"branch_kind": "direct_no_tool",
		"workflow_mode": "primary_agent"
	},
	"terminal_outcome": "grounded_answer",
	"selected_tool": null,
	"selected_tools": [],
	"stage_timing_profile_sha256": "sha256:cccccccccccccccccccccccccccccccccccccccccccccccccccccccccccccccc",
	"tool_runtime_combined_sha256": "sha256:dddddddddddddddddddddddddddddddddddddddddddddddddddddddddddddddd"
}
